{
  "$schema": "https://json-schema.org/draft/2020-12/schema",
  "$id": "https://agentic-workspace.local/schemas/planning-integration-proposal.schema.json",
  "title": "Planning integration proposal",
  "description": "Checked-in feature-branch proposal for a later target-branch Planning lifecycle transition.",
  "type": "object",
  "additionalProperties": false,
  "required": [
    "kind",
    "id",
    "status",
    "phase",
    "requested_transition",
    "owner",
    "external_ref",
    "proof_refs",
    "parent_boundary",
    "preserved_invariants",
    "expected_subject_revision",
    "expected_planning_revision",
    "created_at",
    "updated_at",
    "proposal_revision",
    "authority_boundary"
  ],
  "properties": {
    "kind": {
      "const": "planning-integration-proposal/v1",
      "description": "Schema discriminator for Planning integration proposal records."
    },
    "id": {
      "type": "string",
      "minLength": 1,
      "description": "Stable proposal identifier used by apply and receipt records."
    },
    "status": {
      "enum": [
        "pending",
        "integrated",
        "rejected"
      ],
      "description": "Proposal lifecycle state before or after target-branch apply."
    },
    "phase": {
      "enum": [
        "integration-pending",
        "integrated-lifecycle-truth",
        "rejected"
      ],
      "description": "Human-readable proposal phase derived from status and apply state."
    },
    "requested_transition": {
      "enum": [
        "mark-integrated",
        "close-owner",
        "archive-owner",
        "keep-open"
      ],
      "description": "Planning lifecycle transition requested for target-branch apply."
    },
    "owner": {
      "type": "object",
      "additionalProperties": false,
      "required": [
        "id",
        "ref"
      ],
      "properties": {
        "id": {
          "type": "string",
          "description": "Planning owner id affected by the proposed transition."
        },
        "ref": {
          "type": "string",
          "description": "Repo-relative owner record path affected by the proposed transition."
        }
      },
      "description": "Planning owner subject affected by the proposed transition."
    },
    "external_ref": {
      "type": "string",
      "description": "Optional external issue or tracker reference associated with the proposal."
    },
    "proof_refs": {
      "type": "array",
      "items": {
        "type": "string"
      },
      "uniqueItems": true,
      "description": "Evidence references supporting the requested transition."
    },
    "parent_boundary": {
      "type": "string",
      "minLength": 1,
      "description": "Boundary that keeps parent, lane, and aggregate truth independent on feature branches."
    },
    "preserved_invariants": {
      "type": "array",
      "minItems": 1,
      "items": {
        "type": "string"
      },
      "uniqueItems": true,
      "description": "Invariants the proposal asserts are preserved until target-branch apply."
    },
    "expected_subject_revision": {
      "type": "string",
      "minLength": 1,
      "description": "Subject revision expected by target-branch compare-and-apply."
    },
    "expected_planning_revision": {
      "type": "string",
      "minLength": 1,
      "description": "Mandatory target-authority revision captured when the proposal was written; excludes proposal and receipt bookkeeping."
    },
    "created_at": {
      "type": "string",
      "minLength": 1,
      "description": "Creation timestamp recorded by the proposal writer."
    },
    "updated_at": {
      "type": "string",
      "minLength": 1,
      "description": "Last proposal update timestamp recorded by propose or apply."
    },
    "integrated_at": {
      "type": "string",
      "description": "Timestamp set when the target branch applies the proposal."
    },
    "integration_receipt_ref": {
      "type": "string",
      "description": "Repo-relative receipt path written when the proposal is applied."
    },
    "proposal_revision": {
      "type": "string",
      "minLength": 1,
      "description": "Content revision token for the proposal record."
    },
    "authority_boundary": {
      "type": "object",
      "additionalProperties": true,
      "required": [
        "proposal",
        "integrated_truth",
        "non_authority"
      ],
      "properties": {
        "proposal": {
          "type": "string",
          "minLength": 1,
          "description": "Authority statement for feature-branch proposal records."
        },
        "integrated_truth": {
          "type": "string",
          "minLength": 1,
          "description": "Authority statement for target-branch integration receipts."
        },
        "non_authority": {
          "type": "array",
          "items": {
            "type": "string"
          },
          "minItems": 1,
          "description": "Planning surfaces the proposal must not rewrite or claim as authoritative."
        }
      },
      "description": "Explicit boundary between branch proposal authority and integrated target truth."
    }
  },
  "x-agentic-workspace-doc-role": "schema-reference"
}
