{
  "kind": "planning-integration-proposal/v1",
  "id": "issue-2570-memory-effectiveness-archive-owner",
  "status": "pending",
  "phase": "integration-pending",
  "requested_transition": "archive-owner",
  "owner": {
    "id": "issue-2570-memory-effectiveness",
    "ref": ".agentic-workspace/planning/execplans/issue-2570-memory-effectiveness.plan.json"
  },
  "external_ref": "GitHub #2571 and #2572",
  "proof_refs": [
    "tests/test_memory_effectiveness.py",
    "tests/test_operating_decision.py",
    "tests/test_workspace_projection_reuse.py",
    "tests/test_workspace_cli.py",
    "tests/test_workspace_implement_cli.py",
    "tests/test_workspace_summary_cli.py",
    "packages/memory/tests"
  ],
  "parent_boundary": "Archive this slice only after the final stacked PR is integrated; the parent decomposition retains independent aggregate truth until every lane lands.",
  "preserved_invariants": [
    "candidate discovery is not use",
    "Memory remains advisory",
    "canonical decision identity",
    "existing consequence ownership",
    "proof-bound lifecycle review"
  ],
  "expected_subject_revision": "4",
  "expected_planning_revision": "716a237fb94db700",
  "created_at": "2026-08-16T13:07:38.146685Z",
  "updated_at": "2026-08-16T13:07:38.146685Z",
  "authority_boundary": {
    "proposal": "feature-branch declaration",
    "integrated_truth": "integration receipt after apply",
    "non_authority": [
      "current selection",
      "aggregate indexes",
      "unrelated owners",
      "terminal parent truth"
    ],
    "branch_admission": {
      "status": "inside-git",
      "branch": "agent/memory-decision-effectiveness",
      "phase": "feature"
    }
  },
  "proposal_revision": "6379218995a4a1a4"
}
