{
  "kind": "planning-integration-proposal/v1",
  "id": "issue-2464-replayable-missing-current-slice-mark-integrated",
  "status": "integrated",
  "phase": "integrated-lifecycle-truth",
  "requested_transition": "mark-integrated",
  "owner": {
    "id": "issue-2464-replayable-missing-current-slice",
    "ref": ".agentic-workspace/planning/execplans/issue-2464-replayable-missing-current-slice.plan.json"
  },
  "external_ref": "",
  "proof_refs": [],
  "parent_boundary": "parent and lane remain open unless an independent boundary is satisfied",
  "preserved_invariants": [
    "feature branch does not select current work",
    "feature branch does not rewrite aggregate Planning indexes",
    "feature branch does not close parent/lane lifecycle truth",
    "integration apply is target-branch authoritative"
  ],
  "expected_subject_revision": "a3fbb87d1a6b4f32",
  "expected_planning_revision": "5c7d3565e4867a96",
  "created_at": "2026-08-09T17:04:12.179367Z",
  "updated_at": "2026-08-28T21:11:10.616243Z",
  "authority_boundary": {
    "proposal": "feature-branch declaration",
    "integrated_truth": "integration receipt after apply",
    "non_authority": [
      "current selection",
      "aggregate indexes",
      "unrelated owners",
      "terminal parent truth"
    ],
    "branch_admission": {
      "status": "inside-git",
      "branch": "codex/issue-2464-replayable-missing-current-slice",
      "phase": "feature"
    }
  },
  "proposal_revision": "c7b0edca17d887e4",
  "integrated_at": "2026-08-28T21:11:10.616243Z",
  "integration_receipt_ref": ".agentic-workspace/planning/integration-receipts/issue-2464-replayable-missing-current-slice-mark-integrated.integration-receipt.json"
}
